{
  "$schema": "https://json-schema.org/draft/2020-12/schema",
  "$id": "https://udos.dev/schemas/workflow-action-contract.schema.json",
  "title": "uDOS Workflow Action Contract",
  "type": "object",
  "required": [
    "version",
    "owner",
    "schema",
    "summary",
    "required_fields",
    "action_values",
    "owners"
  ],
  "properties": {
    "version": {
      "const": "v2.0.4"
    },
    "owner": {
      "const": "uDOS-core"
    },
    "schema": {
      "const": "schemas/workflow-action-contract.schema.json"
    },
    "summary": {
      "type": "string"
    },
    "required_fields": {
      "type": "array",
      "items": {
        "type": "string"
      },
      "minItems": 5
    },
    "action_values": {
      "type": "array",
      "items": {
        "type": "string"
      },
      "minItems": 4
    },
    "owners": {
      "type": "object",
      "required": [
        "contract",
        "policy",
        "touch_consumers"
      ],
      "properties": {
        "contract": {
          "const": "uDOS-core"
        },
        "policy": {
          "const": "uDOS-wizard"
        },
        "touch_consumers": {
          "type": "array",
          "items": {
            "type": "string"
          }
        }
      },
      "additionalProperties": false
    }
  },
  "additionalProperties": false
}
